Title,Runtime,Released,Country,Director,Writer,Actors,Genre,Ratings,Awards,productionBudget,domesticGross,worldwideGross,openingWeekendGross
Cake,102,2015/01/23,United States,Daniel Barnz,Patrick Tobin,"Jennifer Aniston, Adriana Barraza, Anna Kendrick",Drama,"Internet Movie Database:6.4, Rotten Tomatoes:4.9, Metacritic:4.9",5 wins & 8 nominations total,7000000,1951776,2433850,916179
Darker Than Night,110,2014/09/26,Mexico,Henry Bedwell,"Henry Bedwell, Carlos Enrique Taboada","Zuria Vega, Adriana Louvier, Eréndira Ibarra",Horror,Internet Movie Database:4.3,3 nominations total,37700000,870063,6160114,539867
Paul Blart: Mall Cop 2,94,2015/04/17,United States,Andy Fickman,"Kevin James, Nick Bakay","Kevin James, Raini Rodriguez, Eduardo Verástegui","Action, Comedy, Crime","Internet Movie Database:4.5, Rotten Tomatoes:6.0, Metacritic:1.3",1 win & 9 nominations total,30000000,71038190,107588679,23762435
The Sea of Trees,110,2016/08/26,United States,Gus Van Sant,Chris Sparling,"Matthew McConaughey, Naomi Watts, Ken Watanabe","Drama, Fantasy, Mystery","Internet Movie Database:6.1, Rotten Tomatoes:1.9, Metacritic:2.3",2 nominations total,25000000,20444,906995,1877
War for the Planet of the Apes,140,2017/07/14,United States,Matt Reeves,"Mark Bomback, Matt Reeves, Rick Jaffa","Andy Serkis, Woody Harrelson, Steve Zahn","Action, Adventure, Drama","Internet Movie Database:7.4, Rotten Tomatoes:9.4, Metacritic:8.2",Nominated for 1 Oscar. 28 wins & 65 nominations total,150000000,146880162,490719763,56262929
10 Days in a Madhouse,111,2015/11/11,United States,Timothy Hines,Timothy Hines,"Caroline Barry, Christopher Lambert, Kelly LeBrock","Drama, History",Internet Movie Database:5.7,,100000,14616,14616,4773
